{
  "reviewed_proposal_id": "f1111111-1111-4111-8111-111111111111",
  "reviewed_agent_run_id": "eeeeeeee-eeee-4eee-8eee-eeeeeeeeeeee",
  "target_type": "resource",
  "reviewed_payload": {
    "resource_draft_id": "f7121111-1111-4111-8111-111111111111",
    "title": "链表反转中的三个指针"
  },
  "evidence_ids": [
    "fd111111-1111-4111-8111-111111111111"
  ]
}
